{
  "version": "2",
  "objective": "AGY-managed run: Antigravity is the L0 manager; two Antigravity lanes and two Claude Code lanes work concurrently, an Antigravity auditor gates the result. Launch with: sh scripts/agy_host.sh assets/lanes.agy-manager.example.json",
  "base_ref": "main",
  "worktree_root": ".worktrees",
  "terminal_layout": "auto",
  "integration_cmd": "make ci",
  "worker": {
    "max_turns": 40,
    "timeout_s": 1800
  },
  "lanes": [
    {
      "id": "agy-core",
      "domain": "backend",
      "objective": "Implement the retry policy in src/core/retry.py per docs/decisions/0007; tests in tests/unit/test_retry.py must pass.",
      "owned_paths": ["src/core/**", "tests/unit/test_retry.py"],
      "read_paths": ["docs/decisions/"],
      "worker": { "harness": "antigravity", "timeout_s": 1800 },
      "positive_cmd": "python -m pytest -q tests/unit/test_retry.py",
      "negative_control_cmd": "cp src/core/retry.py .nc-1.bak; trap 'mv .nc-1.bak src/core/retry.py' EXIT; sed -i 's/max_attempts = 5/max_attempts = 0/' src/core/retry.py; python -m pytest -q tests/unit/test_retry.py -k attempts",
      "negative_expect": "attempts|FAILED",
      "task_id": "T-101"
    },
    {
      "id": "agy-api",
      "domain": "backend",
      "objective": "Add the /v2/status endpoint in src/api/status.py with schema validation; tests in tests/unit/test_status.py must pass.",
      "owned_paths": ["src/api/**", "tests/unit/test_status.py"],
      "worker": { "harness": "antigravity", "timeout_s": 1800 },
      "positive_cmd": "python -m pytest -q tests/unit/test_status.py",
      "negative_control_cmd": "cp src/api/status.py .nc-2.bak; trap 'mv .nc-2.bak src/api/status.py' EXIT; sed -i 's/required=True/required=False/' src/api/status.py; python -m pytest -q tests/unit/test_status.py -k required",
      "negative_expect": "required|FAILED",
      "task_id": "T-102"
    },
    {
      "id": "cc-tests",
      "domain": "qa",
      "objective": "Raise branch coverage of src/core/** to >= 85% with meaningful assertions (no assertion-free tests); mutation kill ratio >= 0.8 on changed files.",
      "owned_paths": ["tests/unit/test_core_*.py"],
      "read_paths": ["src/core/"],
      "worker": {
        "harness": "claude-code",
        "model": "claude-sonnet-5",
        "allowed_tools": "Read,Edit,Write,Glob,Grep,Bash(python:*),Bash(pytest:*)"
      },
      "positive_cmd": "python -m pytest -q tests/unit --cov=src/core --cov-branch --cov-fail-under=85",
      "negative_control_cmd": "cp src/core/retry.py .nc-3.bak; trap 'mv .nc-3.bak src/core/retry.py' EXIT; sed -i 's/return result/return None/' src/core/retry.py; python -m pytest -q tests/unit -k retry",
      "negative_expect": "FAILED",
      "mutation_cmd": "mutmut run --paths-to-mutate src/core --CI",
      "task_id": "T-103"
    },
    {
      "id": "cc-docs",
      "domain": "docs",
      "depends_on": ["agy-core", "agy-api"],
      "objective": "Document the retry policy and /v2/status endpoint in docs/; docs build passes and links resolve.",
      "owned_paths": ["docs/**"],
      "worker": {
        "harness": "claude-code",
        "model": "claude-haiku-4-5-20251001",
        "allowed_tools": "Read,Edit,Write,Glob,Grep,Bash(make docs:*),Bash(python:*)"
      },
      "positive_cmd": "make docs && python scripts/checks/links.py docs/",
      "negative_control_cmd": "cp docs/index.md .nc-4.bak; trap 'mv .nc-4.bak docs/index.md' EXIT; printf '[dead](../nope.md)\\n' >> docs/index.md; python scripts/checks/links.py docs/",
      "negative_expect": "nope\\.md",
      "task_id": "T-104"
    },
    {
      "id": "agy-audit",
      "domain": "qa",
      "role": "auditor",
      "depends_on": ["agy-core", "agy-api", "cc-tests"],
      "objective": "Audit the other lanes' diffs against SKILL.md section 7: plant one violation per repaired check, prove non-zero exit naming it, record any vacuous check in tests/checks/VACUOUS.md with a fix.",
      "owned_paths": ["tests/checks/**"],
      "read_paths": ["src/", "tests/unit/"],
      "worker": { "harness": "antigravity", "timeout_s": 1200 },
      "positive_cmd": "python -m pytest -q tests/checks",
      "negative_control_cmd": "cp tests/checks/VACUOUS.md .nc-5.bak; trap 'mv .nc-5.bak tests/checks/VACUOUS.md' EXIT; printf '\\n# planted-vacuous\\n' >> tests/checks/VACUOUS.md; python -m pytest -q tests/checks -k vacuous",
      "negative_expect": "planted-vacuous|VACUOUS",
      "task_id": "T-105"
    }
  ]
}
