{
  "version": "2",
  "objective": "Async telemetry pipeline with schema validation, audited by a second vendor, docs by a third.",
  "base_ref": "main",
  "worktree_root": ".worktrees",
  "terminal_layout": "auto",
  "integration_cmd": "make ci",
  "worker": {
    "max_turns": 40,
    "timeout_s": 1800,
    "api_key_env": "OPENAI_API_KEY",
    "env": {
      "ENV_MODE": "test",
      "CI_STRICT": "1"
    }
  },
  "lanes": [
    {
      "id": "be-async",
      "domain": "backend",
      "objective": "Refactor src/telemetry/queue.py to AsyncQueue with an atomic write buffer and exponential backoff; tests in tests/unit/test_telemetry_async.py must pass.",
      "owned_paths": [
        "src/telemetry/**",
        "tests/unit/test_telemetry_async.py"
      ],
      "read_paths": [
        "docs/adr/"
      ],
      "worker": {
        "harness": "claude-code",
        "model": "claude-sonnet-4-6",
        "allowed_tools": "Read,Edit,Write,Glob,Grep,Bash(python:*),Bash(pytest:*)"
      },
      "positive_cmd": "python -m pytest -q tests/unit/test_telemetry_async.py",
      "negative_control_cmd": "cp src/telemetry/queue.py .nc-1.bak; trap 'mv .nc-1.bak src/telemetry/queue.py' EXIT; sed -i 's/backoff_factor = 2/backoff_factor = 0/' src/telemetry/queue.py; python -m pytest -q tests/unit/test_telemetry_async.py -k backoff",
      "negative_expect": "test_.*backoff.*FAILED|assert.*backoff",
      "full_gate_cmd": "make test",
      "task_id": "T-002",
      "mutation_cmd": "mutmut run --paths-to-mutate src/telemetry --CI"
    },
    {
      "id": "qa-audit",
      "domain": "qa",
      "role": "auditor",
      "depends_on": [
        "be-async"
      ],
      "objective": "Audit that every check under scripts/checks/ can fail: plant one violation per check, prove non-zero exit naming it, record vacuous checks in tests/checks/VACUOUS.md with a fix for each.",
      "owned_paths": [
        "tests/checks/**"
      ],
      "read_paths": [
        "scripts/checks/"
      ],
      "worker": {
        "harness": "copilot",
        "allowed_tools": "shell(python:*),shell(pytest:*),write",
        "model": "gpt-5-mini"
      },
      "positive_cmd": "python -m pytest -q tests/checks",
      "negative_control_cmd": "cp tests/checks/VACUOUS.md .nc-2.bak; trap 'mv .nc-2.bak tests/checks/VACUOUS.md' EXIT; printf '\\n# planted-vacuous\\n' >> tests/checks/VACUOUS.md; python -m pytest -q tests/checks -k vacuous",
      "negative_expect": "planted-vacuous|VACUOUS"
    },
    {
      "id": "docs",
      "domain": "docs",
      "depends_on": [
        "be-async"
      ],
      "objective": "Update docs/telemetry.md and the ADR for the async queue; docs build must pass and links must resolve.",
      "owned_paths": [
        "docs/**"
      ],
      "worker": {
        "harness": "cursor",
        "timeout_s": 900
      },
      "positive_cmd": "make docs && python scripts/checks/links.py docs/",
      "negative_control_cmd": "cp docs/telemetry.md .nc-3.bak; trap 'mv .nc-3.bak docs/telemetry.md' EXIT; printf '[dead](../nope.md)\\n' >> docs/telemetry.md; python scripts/checks/links.py docs/",
      "negative_expect": "nope\\.md"
    },
    {
      "id": "local-lint",
      "domain": "infra",
      "objective": "Make `make lint` clean for src/infra/** without adding suppressions; explain each fix in the commit body.",
      "owned_paths": [
        "src/infra/**"
      ],
      "worker": {
        "harness": "openai-compatible",
        "model": "qwen2.5-coder:32b",
        "base_url": "http://localhost:11434/v1"
      },
      "positive_cmd": "make lint",
      "negative_control_cmd": "cp src/infra/__init__.py .nc-4.bak; trap 'mv .nc-4.bak src/infra/__init__.py' EXIT; printf 'import os\\n' >> src/infra/__init__.py; make lint",
      "negative_expect": "F401|unused import"
    },
    {
      "id": "infra-lint-2",
      "domain": "infra",
      "objective": "Make `make lint` clean for src/cli/** without adding suppressions.",
      "owned_paths": [
        "src/cli/**"
      ],
      "worker": {
        "harness": "opencode",
        "model": "openai/gpt-5-mini"
      },
      "positive_cmd": "make lint",
      "negative_control_cmd": "cp src/cli/__init__.py .nc-5.bak; trap 'mv .nc-5.bak src/cli/__init__.py' EXIT; printf 'import os\\n' >> src/cli/__init__.py; make lint",
      "negative_expect": "F401|unused import"
    }
  ]
}